rdna4/trellis2/triton_aot/klin/shapes.json
[
  {
    "tag": "stage0_klin_up",
    "M_max": 1905,
    "K": 1024,
    "N": 4096,
    "BM": 128,
    "BN": 128,
    "BK": 32,
    "num_warps": 4,
    "num_stages": 2,
    "shared": 16384
  },
  {
    "tag": "stage0_klin_dn",
    "M_max": 1905,
    "K": 4096,
    "N": 1024,
    "BM": 64,
    "BN": 128,
    "BK": 64,
    "num_warps": 4,
    "num_stages": 2,
    "shared": 8192
  },
  {
    "tag": "stage1_klin_up",
    "M_max": 8452,
    "K": 512,
    "N": 2048,
    "BM": 64,
    "BN": 128,
    "BK": 64,
    "num_warps": 4,
    "num_stages": 2,
    "shared": 8192
  },
  {
    "tag": "stage1_klin_dn",
    "M_max": 8452,
    "K": 2048,
    "N": 512,
    "BM": 64,
    "BN": 128,
    "BK": 64,
    "num_warps": 4,
    "num_stages": 2,
    "shared": 8192
  },
  {
    "tag": "stage2_klin_up",
    "M_max": 16384,
    "K": 256,
    "N": 1024,
    "BM": 64,
    "BN": 256,
    "BK": 32,
    "num_warps": 8,
    "num_stages": 2,
    "shared": 4096
  },
  {
    "tag": "stage2_klin_dn",
    "M_max": 16384,
    "K": 1024,
    "N": 256,
    "BM": 64,
    "BN": 128,
    "BK": 64,
    "num_warps": 4,
    "num_stages": 2,
    "shared": 8192
  },
  {
    "tag": "stage3_klin_up",
    "M_max": 16384,
    "K": 128,
    "N": 512,
    "BM": 64,
    "BN": 256,
    "BK": 32,
    "num_warps": 8,
    "num_stages": 2,
    "shared": 4096
  },
  {
    "tag": "stage3_klin_dn",
    "M_max": 16384,
    "K": 512,
    "N": 128,
    "BM": 64,
    "BN": 128,
    "BK": 64,
    "num_warps": 4,
    "num_stages": 2,
    "shared": 8192
  }
]